<?xml version="1.0" encoding="utf-8"?><LI_Get_Creditcard_Transactions_response xmlns:xsd="http://www.w3.org/2001/XMLSchema" xmlns:xsi="http://www.w3.org/2001/XMLSchema-instance" version="1.2"><time><date_arrived>2025-09-13T11:43:07.6127168+00:00</date_arrived><date_response>2025-09-13T11:43:07.9746829+00:00</date_response></time><balance>5721.00</balance><award_point_state>0</award_point_state><total_withdrawal>403078.0</total_withdrawal><withdrawals><withdrawal><entry_id>30.10.2023 18:04:41</entry_id><clearance_id>441632</clearance_id><foreign>true</foreign><date>2023-10-30</date><amount>107700</amount><foreign_amount>-753.7</foreign_amount><currency>USD</currency><trans_key>05</trans_key><merchant_name>Upwork -634314934REF</merchant_name><due_date>2023-11-02</due_date><mcc>7361</mcc></withdrawal><withdrawal><entry_id>26.10.2023 22:59:26</entry_id><clearance_id>926528</clearance_id><foreign>true</foreign><date>2023-10-26</date><amount>285</amount><foreign_amount>-1.99</foreign_amount><currency>USD</currency><trans_key>05</trans_key><merchant_name>GOOGLE *Google Storage</merchant_name><due_date>2023-11-02</due_date><mcc>5816</mcc></withdrawal><withdrawal><entry_id>26.10.2023 18:21:14</entry_id><clearance_id>409026</clearance_id><foreign>false</foreign><date>2023-10-26</date><amount>15809</amount><foreign_amount>0</foreign_amount><currency>ISK</currency><trans_key>05</trans_key><merchant_name>N1 Holmavik sjalfs</merchant_name><due_date>2023-11-02</due_date><mcc>5542</mcc></withdrawal><withdrawal><entry_id>25.10.2023 16:57:42</entry_id><clearance_id>742388</clearance_id><foreign>false</foreign><date>2023-10-25</date><amount>6573</amount><foreign_amount>0</foreign_amount><currency>ISK</currency><trans_key>05</trans_key><merchant_name>Kronan Borgartuni</merchant_name><due_date>2023-11-02</due_date><mcc>5411</mcc></withdrawal><withdrawal><entry_id>25.10.2023 16:43:52</entry_id><clearance_id>352099</clearance_id><foreign>false</foreign><date>2023-10-25</date><amount>284</amount><foreign_amount>0</foreign_amount><currency>ISK</currency><trans_key>05</trans_key><merchant_name>Parka - Bilastaedi</merchant_name><due_date>2023-11-02</due_date><mcc>7523</mcc></withdrawal><withdrawal><entry_id>25.10.2023 15:48:03</entry_id><clearance_id>803118</clearance_id><foreign>false</foreign><date>2023-10-25</date><amount>50891</amount><foreign_amount>0</foreign_amount><currency>ISK</currency><trans_key>05</trans_key><merchant_name>Parka - Bilastaedi</merchant_name><due_date>2023-11-02</due_date><mcc>7523</mcc></withdrawal><withdrawal><entry_id>24.10.2023 22:53:06</entry_id><clearance_id>306539</clearance_id><foreign>true</foreign><date>2023-10-24</date><amount>2126</amount><foreign_amount>-14.99</foreign_amount><currency>USD</currency><trans_key>05</trans_key><merchant_name>Upwork -632230544Membersh</merchant_name><due_date>2023-11-02</due_date><mcc>7361</mcc></withdrawal><withdrawal><entry_id>23.10.2023 13:54:44</entry_id><clearance_id>444385</clearance_id><foreign>false</foreign><date>2023-10-23</date><amount>2682</amount><foreign_amount>0</foreign_amount><currency>ISK</currency><trans_key>05</trans_key><merchant_name>Parka - Bilastaedi</merchant_name><due_date>2023-11-02</due_date><mcc>7523</mcc></withdrawal><withdrawal><entry_id>21.10.2023 18:24:25</entry_id><clearance_id>425066</clearance_id><foreign>false</foreign><date>2023-10-21</date><amount>38280</amount><foreign_amount>0</foreign_amount><currency>ISK</currency><trans_key>05</trans_key><merchant_name>Tokyo veitingar</merchant_name><due_date>2023-11-02</due_date><mcc>5812</mcc></withdrawal><withdrawal><entry_id>21.10.2023 18:10:47</entry_id><clearance_id>047199</clearance_id><foreign>false</foreign><date>2023-10-21</date><amount>23980</amount><foreign_amount>0</foreign_amount><currency>ISK</currency><trans_key>05</trans_key><merchant_name>Kronan Borgartuni</merchant_name><due_date>2023-11-02</due_date><mcc>5411</mcc></withdrawal><withdrawal><entry_id>21.10.2023 01:03:47</entry_id><clearance_id>347003</clearance_id><foreign>true</foreign><date>2023-10-21</date><amount>1682</amount><foreign_amount>-11.2</foreign_amount><currency>EUR</currency><trans_key>05</trans_key><merchant_name>MSFT * E0500PJFIJ</merchant_name><due_date>2023-11-02</due_date><mcc>5045</mcc></withdrawal><withdrawal><entry_id>21.10.2023 00:33:40</entry_id><clearance_id>340476</clearance_id><foreign>true</foreign><date>2023-10-21</date><amount>1261</amount><foreign_amount>-8.4</foreign_amount><currency>EUR</currency><trans_key>05</trans_key><merchant_name>MSFT *&lt;E0500PJFII&gt;</merchant_name><due_date>2023-11-02</due_date><mcc>5045</mcc></withdrawal><withdrawal><entry_id>20.10.2023 18:04:34</entry_id><clearance_id>434324</clearance_id><foreign>false</foreign><date>2023-10-20</date><amount>1109</amount><foreign_amount>0</foreign_amount><currency>ISK</currency><trans_key>05</trans_key><merchant_name>Parka - Bilastaedi</merchant_name><due_date>2023-11-02</due_date><mcc>7523</mcc></withdrawal><withdrawal><entry_id>16.10.2023 11:04:19</entry_id><clearance_id>419675</clearance_id><foreign>false</foreign><date>2023-10-16</date><amount>29447</amount><foreign_amount>0</foreign_amount><currency>ISK</currency><trans_key>05</trans_key><merchant_name>Kronan Fiskislod</merchant_name><due_date>2023-11-02</due_date><mcc>5411</mcc></withdrawal><withdrawal><entry_id>12.10.2023 18:50:26</entry_id><clearance_id>026149</clearance_id><foreign>true</foreign><date>2023-10-12</date><amount>1802</amount><foreign_amount>-11.99</foreign_amount><currency>EUR</currency><trans_key>05</trans_key><merchant_name>Google Payment IE LTD You</merchant_name><due_date>2023-11-02</due_date><mcc>5817</mcc></withdrawal><withdrawal><entry_id>11.10.2023 15:29:17</entry_id><clearance_id>916850</clearance_id><foreign>false</foreign><date>2023-10-11</date><amount>1566</amount><foreign_amount>0</foreign_amount><currency>ISK</currency><trans_key>05</trans_key><merchant_name>Parka - Bilastaedi</merchant_name><due_date>2023-11-02</due_date><mcc>7523</mcc></withdrawal><withdrawal><entry_id>11.10.2023 12:45:54</entry_id><clearance_id>554334</clearance_id><foreign>false</foreign><date>2023-10-11</date><amount>1896</amount><foreign_amount>0</foreign_amount><currency>ISK</currency><trans_key>05</trans_key><merchant_name>Parka - Bilastaedi</merchant_name><due_date>2023-11-02</due_date><mcc>7523</mcc></withdrawal><withdrawal><entry_id>11.10.2023 09:45:21</entry_id><clearance_id>521293</clearance_id><foreign>false</foreign><date>2023-10-11</date><amount>8038</amount><foreign_amount>0</foreign_amount><currency>ISK</currency><trans_key>05</trans_key><merchant_name>Parka - Bilastaedi</merchant_name><due_date>2023-11-02</due_date><mcc>7523</mcc></withdrawal><withdrawal><entry_id>10.10.2023 12:44:28</entry_id><clearance_id>428363</clearance_id><foreign>false</foreign><date>2023-10-10</date><amount>273</amount><foreign_amount>0</foreign_amount><currency>ISK</currency><trans_key>05</trans_key><merchant_name>Parka - Bilastaedi</merchant_name><due_date>2023-11-02</due_date><mcc>7523</mcc></withdrawal><withdrawal><entry_id>9.10.2023 16:12:17</entry_id><clearance_id>217668</clearance_id><foreign>false</foreign><date>2023-10-09</date><amount>493</amount><foreign_amount>0</foreign_amount><currency>ISK</currency><trans_key>05</trans_key><merchant_name>Parka - Bilastaedi</merchant_name><due_date>2023-11-02</due_date><mcc>7523</mcc></withdrawal><withdrawal><entry_id>9.10.2023 01:11:03</entry_id><clearance_id>103635</clearance_id><foreign>true</foreign><date>2023-10-09</date><amount>1930</amount><foreign_amount>-12.95</foreign_amount><currency>EUR</currency><trans_key>05</trans_key><merchant_name>MICROSOFT#G030016378</merchant_name><due_date>2023-11-02</due_date><mcc>5045</mcc></withdrawal><withdrawal><entry_id>8.10.2023 10:02:30</entry_id><clearance_id>230257</clearance_id><foreign>false</foreign><date>2023-10-08</date><amount>5700</amount><foreign_amount>0</foreign_amount><currency>ISK</currency><trans_key>05</trans_key><merchant_name>Hedinn Kitchen og Bar</merchant_name><due_date>2023-11-02</due_date><mcc>5812</mcc></withdrawal><withdrawal><entry_id>4.10.2023 12:24:55</entry_id><clearance_id>455512</clearance_id><foreign>false</foreign><date>2023-10-04</date><amount>14396</amount><foreign_amount>0</foreign_amount><currency>ISK</currency><trans_key>05</trans_key><merchant_name>Galleri Sautjan Smaral</merchant_name><due_date>2023-11-02</due_date><mcc>5651</mcc></withdrawal><withdrawal><entry_id>4.10.2023 12:17:48</entry_id><clearance_id>748375</clearance_id><foreign>false</foreign><date>2023-10-04</date><amount>35252</amount><foreign_amount>0</foreign_amount><currency>ISK</currency><trans_key>05</trans_key><merchant_name>Herragardurinn Smaral</merchant_name><due_date>2023-11-02</due_date><mcc>5651</mcc></withdrawal><withdrawal><entry_id>3.10.2023 13:15:53</entry_id><clearance_id>553416</clearance_id><foreign>false</foreign><date>2023-10-03</date><amount>1098</amount><foreign_amount>0</foreign_amount><currency>ISK</currency><trans_key>05</trans_key><merchant_name>Parka - Bilastaedi</merchant_name><due_date>2023-11-02</due_date><mcc>7523</mcc></withdrawal><withdrawal><entry_id>3.10.2023 13:04:15</entry_id><clearance_id>415543</clearance_id><foreign>false</foreign><date>2023-10-03</date><amount>2795</amount><foreign_amount>0</foreign_amount><currency>ISK</currency><trans_key>05</trans_key><merchant_name>Fjallkonan</merchant_name><due_date>2023-11-02</due_date><mcc>5812</mcc></withdrawal><withdrawal><entry_id>3.10.2023 09:21:59</entry_id><clearance_id>159167</clearance_id><foreign>true</foreign><date>2023-10-03</date><amount>1718</amount><foreign_amount>-12.0</foreign_amount><currency>USD</currency><trans_key>05</trans_key><merchant_name>HARVEST</merchant_name><due_date>2023-11-02</due_date><mcc>5045</mcc></withdrawal><withdrawal><entry_id>3.10.2023 05:49:29</entry_id><clearance_id>929751</clearance_id><foreign>false</foreign><date>2023-10-03</date><amount>5062</amount><foreign_amount>0</foreign_amount><currency>ISK</currency><trans_key>05</trans_key><merchant_name>Virta EV Charge Processor</merchant_name><due_date>2023-11-02</due_date><mcc>5552</mcc></withdrawal><withdrawal><entry_id>2.10.2023 16:07:52</entry_id><clearance_id>752660</clearance_id><foreign>false</foreign><date>2023-10-02</date><amount>38950</amount><foreign_amount>0</foreign_amount><currency>ISK</currency><trans_key>05</trans_key><merchant_name>Rafha</merchant_name><due_date>2023-11-02</due_date><mcc>5732</mcc></withdrawal></withdrawals><deposits><deposit><foreign>false</foreign><date>2023-10-30</date><description>Innborgun</description><amount>50000</amount><foreign_amount>0</foreign_amount><currency>ISK</currency></deposit><deposit><foreign>false</foreign><date>2023-10-25</date><description>Innborgun</description><amount>150000</amount><foreign_amount>0</foreign_amount><currency>ISK</currency></deposit><deposit><foreign>false</foreign><date>2023-10-23</date><description>Innborgun</description><amount>10000</amount><foreign_amount>0</foreign_amount><currency>ISK</currency></deposit><deposit><foreign>false</foreign><date>2023-10-21</date><description>Endurgreiðsla</description><amount>5972</amount><foreign_amount>0</foreign_amount><currency>ISK</currency></deposit><deposit><foreign>false</foreign><date>2023-10-11</date><description>Innborgun</description><amount>100000</amount><foreign_amount>0</foreign_amount><currency>ISK</currency></deposit><deposit><foreign>false</foreign><date>2023-10-04</date><description>Innborgun</description><amount>60000</amount><foreign_amount>0</foreign_amount><currency>ISK</currency></deposit></deposits></LI_Get_Creditcard_Transactions_response>