<?xml version="1.0" encoding="utf-8"?><LI_Get_Creditcard_Transactions_response xmlns:xsd="http://www.w3.org/2001/XMLSchema" xmlns:xsi="http://www.w3.org/2001/XMLSchema-instance" version="1.2"><time><date_arrived>2025-09-13T11:43:08.2101468+00:00</date_arrived><date_response>2025-09-13T11:43:08.5514562+00:00</date_response></time><balance>5721.00</balance><award_point_state>0</award_point_state><total_withdrawal>283047.0</total_withdrawal><withdrawals><withdrawal><entry_id>30.11.2023 15:56:19</entry_id><clearance_id>619823</clearance_id><foreign>false</foreign><date>2023-11-30</date><amount>2418</amount><foreign_amount>0</foreign_amount><currency>ISK</currency><trans_key>05</trans_key><merchant_name>Parka</merchant_name><due_date>2023-12-04</due_date><mcc>7523</mcc></withdrawal><withdrawal><entry_id>27.11.2023 17:48:45</entry_id><clearance_id>845125</clearance_id><foreign>false</foreign><date>2023-11-27</date><amount>394</amount><foreign_amount>0</foreign_amount><currency>ISK</currency><trans_key>05</trans_key><merchant_name>Parka</merchant_name><due_date>2023-12-04</due_date><mcc>7523</mcc></withdrawal><withdrawal><entry_id>27.11.2023 17:15:42</entry_id><clearance_id>542146</clearance_id><foreign>false</foreign><date>2023-11-27</date><amount>496</amount><foreign_amount>0</foreign_amount><currency>ISK</currency><trans_key>05</trans_key><merchant_name>Parka</merchant_name><due_date>2023-12-04</due_date><mcc>7523</mcc></withdrawal><withdrawal><entry_id>27.11.2023 10:10:04</entry_id><clearance_id>004732</clearance_id><foreign>false</foreign><date>2023-11-27</date><amount>18939</amount><foreign_amount>0</foreign_amount><currency>ISK</currency><trans_key>05</trans_key><merchant_name>Kronan Borgartuni</merchant_name><due_date>2023-12-04</due_date><mcc>5411</mcc></withdrawal><withdrawal><entry_id>26.11.2023 22:59:27</entry_id><clearance_id>927412</clearance_id><foreign>true</foreign><date>2023-11-26</date><amount>281</amount><foreign_amount>-1.99</foreign_amount><currency>USD</currency><trans_key>05</trans_key><merchant_name>GOOGLE *Google Play Ap</merchant_name><due_date>2023-12-04</due_date><mcc>4899</mcc></withdrawal><withdrawal><entry_id>26.11.2023 13:01:47</entry_id><clearance_id>147184</clearance_id><foreign>false</foreign><date>2023-11-26</date><amount>7500</amount><foreign_amount>0</foreign_amount><currency>ISK</currency><trans_key>05</trans_key><merchant_name>Saetar Syndir Kampavinska</merchant_name><due_date>2023-12-04</due_date><mcc>5462</mcc></withdrawal><withdrawal><entry_id>25.11.2023 17:26:47</entry_id><clearance_id>647108</clearance_id><foreign>false</foreign><date>2023-11-25</date><amount>17008</amount><foreign_amount>0</foreign_amount><currency>ISK</currency><trans_key>05</trans_key><merchant_name>Gardheimar</merchant_name><due_date>2023-12-04</due_date><mcc>5261</mcc></withdrawal><withdrawal><entry_id>24.11.2023 17:54:12</entry_id><clearance_id>412030</clearance_id><foreign>false</foreign><date>2023-11-24</date><amount>19234</amount><foreign_amount>0</foreign_amount><currency>ISK</currency><trans_key>05</trans_key><merchant_name>Gardheimar</merchant_name><due_date>2023-12-04</due_date><mcc>5261</mcc></withdrawal><withdrawal><entry_id>24.11.2023 16:42:44</entry_id><clearance_id>244009</clearance_id><foreign>false</foreign><date>2023-11-24</date><amount>726</amount><foreign_amount>0</foreign_amount><currency>ISK</currency><trans_key>05</trans_key><merchant_name>Parka</merchant_name><due_date>2023-12-04</due_date><mcc>7523</mcc></withdrawal><withdrawal><entry_id>24.11.2023 15:16:48</entry_id><clearance_id>648780</clearance_id><foreign>false</foreign><date>2023-11-24</date><amount>686</amount><foreign_amount>0</foreign_amount><currency>ISK</currency><trans_key>05</trans_key><merchant_name>Parka</merchant_name><due_date>2023-12-04</due_date><mcc>7523</mcc></withdrawal><withdrawal><entry_id>24.11.2023 09:10:16</entry_id><clearance_id>016171</clearance_id><foreign>false</foreign><date>2023-11-24</date><amount>51600</amount><foreign_amount>0</foreign_amount><currency>ISK</currency><trans_key>05</trans_key><merchant_name>Borgarleikhusid</merchant_name><due_date>2023-12-04</due_date><mcc>7922</mcc></withdrawal><withdrawal><entry_id>23.11.2023 19:32:11</entry_id><clearance_id>211221</clearance_id><foreign>false</foreign><date>2023-11-23</date><amount>29160</amount><foreign_amount>0</foreign_amount><currency>ISK</currency><trans_key>05</trans_key><merchant_name>Gardheimar</merchant_name><due_date>2023-12-04</due_date><mcc>5261</mcc></withdrawal><withdrawal><entry_id>23.11.2023 07:33:52</entry_id><clearance_id>352813</clearance_id><foreign>true</foreign><date>2023-11-23</date><amount>2177</amount><foreign_amount>-14.99</foreign_amount><currency>USD</currency><trans_key>05</trans_key><merchant_name>Upwork -641354117Membersh</merchant_name><due_date>2023-12-04</due_date><mcc>7361</mcc></withdrawal><withdrawal><entry_id>21.11.2023 17:04:46</entry_id><clearance_id>445947</clearance_id><foreign>false</foreign><date>2023-11-21</date><amount>680</amount><foreign_amount>0</foreign_amount><currency>ISK</currency><trans_key>05</trans_key><merchant_name>Parka</merchant_name><due_date>2023-12-04</due_date><mcc>7523</mcc></withdrawal><withdrawal><entry_id>21.11.2023 15:57:44</entry_id><clearance_id>744769</clearance_id><foreign>false</foreign><date>2023-11-21</date><amount>38970</amount><foreign_amount>0</foreign_amount><currency>ISK</currency><trans_key>05</trans_key><merchant_name>Harpa tonlistarhus</merchant_name><due_date>2023-12-04</due_date><mcc>7922</mcc></withdrawal><withdrawal><entry_id>21.11.2023 01:03:01</entry_id><clearance_id>300921</clearance_id><foreign>true</foreign><date>2023-11-21</date><amount>1750</amount><foreign_amount>-11.2</foreign_amount><currency>EUR</currency><trans_key>05</trans_key><merchant_name>MSFT * E0500PXQHK</merchant_name><due_date>2023-12-04</due_date><mcc>5045</mcc></withdrawal><withdrawal><entry_id>21.11.2023 00:34:23</entry_id><clearance_id>422869</clearance_id><foreign>true</foreign><date>2023-11-21</date><amount>1312</amount><foreign_amount>-8.4</foreign_amount><currency>EUR</currency><trans_key>05</trans_key><merchant_name>MSFT * E0500PXGEJ</merchant_name><due_date>2023-12-04</due_date><mcc>5045</mcc></withdrawal><withdrawal><entry_id>14.11.2023 13:30:00</entry_id><clearance_id>000502</clearance_id><foreign>false</foreign><date>2023-11-14</date><amount>1036</amount><foreign_amount>0</foreign_amount><currency>ISK</currency><trans_key>05</trans_key><merchant_name>Parka</merchant_name><due_date>2023-12-04</due_date><mcc>7523</mcc></withdrawal><withdrawal><entry_id>14.11.2023 13:19:02</entry_id><clearance_id>902573</clearance_id><foreign>false</foreign><date>2023-11-14</date><amount>3285</amount><foreign_amount>0</foreign_amount><currency>ISK</currency><trans_key>05</trans_key><merchant_name>Fjallkonan</merchant_name><due_date>2023-12-04</due_date><mcc>5812</mcc></withdrawal><withdrawal><entry_id>13.11.2023 20:00:57</entry_id><clearance_id>057674</clearance_id><foreign>false</foreign><date>2023-11-13</date><amount>2605</amount><foreign_amount>0</foreign_amount><currency>ISK</currency><trans_key>05</trans_key><merchant_name>Parka</merchant_name><due_date>2023-12-04</due_date><mcc>7523</mcc></withdrawal><withdrawal><entry_id>13.11.2023 16:13:35</entry_id><clearance_id>335047</clearance_id><foreign>true</foreign><date>2023-11-13</date><amount>3624</amount><foreign_amount>-24.8</foreign_amount><currency>USD</currency><trans_key>05</trans_key><merchant_name>CHATGPT SUBSCRIPTION</merchant_name><due_date>2023-12-04</due_date><mcc>5734</mcc></withdrawal><withdrawal><entry_id>13.11.2023 12:45:53</entry_id><clearance_id>553445</clearance_id><foreign>false</foreign><date>2023-11-13</date><amount>570</amount><foreign_amount>0</foreign_amount><currency>ISK</currency><trans_key>05</trans_key><merchant_name>Stokkur f. straeto bs</merchant_name><due_date>2023-12-04</due_date><mcc>4111</mcc></withdrawal><withdrawal><entry_id>12.11.2023 18:50:29</entry_id><clearance_id>029291</clearance_id><foreign>true</foreign><date>2023-11-12</date><amount>1868</amount><foreign_amount>-11.99</foreign_amount><currency>EUR</currency><trans_key>05</trans_key><merchant_name>GOOGLE  YouTube</merchant_name><due_date>2023-12-04</due_date><mcc>5815</mcc></withdrawal><withdrawal><entry_id>9.11.2023 09:24:18</entry_id><clearance_id>418672</clearance_id><foreign>true</foreign><date>2023-11-09</date><amount>3715</amount><foreign_amount>-24.07</foreign_amount><currency>EUR</currency><trans_key>05</trans_key><merchant_name>Microsoft G032566698</merchant_name><due_date>2023-12-04</due_date><mcc>5045</mcc></withdrawal><withdrawal><entry_id>8.11.2023 11:32:53</entry_id><clearance_id>253410</clearance_id><foreign>false</foreign><date>2023-11-08</date><amount>4275</amount><foreign_amount>0</foreign_amount><currency>ISK</currency><trans_key>05</trans_key><merchant_name>Braudgerd Reykjavikur</merchant_name><due_date>2023-12-04</due_date><mcc>5462</mcc></withdrawal><withdrawal><entry_id>7.11.2023 13:18:13</entry_id><clearance_id>813399</clearance_id><foreign>false</foreign><date>2023-11-07</date><amount>1098</amount><foreign_amount>0</foreign_amount><currency>ISK</currency><trans_key>05</trans_key><merchant_name>Parka - Bilastaedi</merchant_name><due_date>2023-12-04</due_date><mcc>7523</mcc></withdrawal><withdrawal><entry_id>6.11.2023 13:08:20</entry_id><clearance_id>819944</clearance_id><foreign>false</foreign><date>2023-11-06</date><amount>570</amount><foreign_amount>0</foreign_amount><currency>ISK</currency><trans_key>05</trans_key><merchant_name>Stokkur f. straeto bs</merchant_name><due_date>2023-12-04</due_date><mcc>4111</mcc></withdrawal><withdrawal><entry_id>6.11.2023 09:37:27</entry_id><clearance_id>727070</clearance_id><foreign>false</foreign><date>2023-11-06</date><amount>570</amount><foreign_amount>0</foreign_amount><currency>ISK</currency><trans_key>05</trans_key><merchant_name>Stokkur f. straeto bs</merchant_name><due_date>2023-12-04</due_date><mcc>4111</mcc></withdrawal><withdrawal><entry_id>5.11.2023 15:16:01</entry_id><clearance_id>601604</clearance_id><foreign>false</foreign><date>2023-11-05</date><amount>1706</amount><foreign_amount>0</foreign_amount><currency>ISK</currency><trans_key>05</trans_key><merchant_name>Parka - Bilastaedi</merchant_name><due_date>2023-12-04</due_date><mcc>7523</mcc></withdrawal><withdrawal><entry_id>4.11.2023 17:06:12</entry_id><clearance_id>612755</clearance_id><foreign>false</foreign><date>2023-11-04</date><amount>566</amount><foreign_amount>0</foreign_amount><currency>ISK</currency><trans_key>05</trans_key><merchant_name>Parka - Bilastaedi</merchant_name><due_date>2023-12-04</due_date><mcc>7523</mcc></withdrawal><withdrawal><entry_id>4.11.2023 12:42:32</entry_id><clearance_id>232718</clearance_id><foreign>false</foreign><date>2023-11-04</date><amount>18399</amount><foreign_amount>0</foreign_amount><currency>ISK</currency><trans_key>05</trans_key><merchant_name>Kronan Borgartuni</merchant_name><due_date>2023-12-04</due_date><mcc>5411</mcc></withdrawal><withdrawal><entry_id>3.11.2023 14:11:48</entry_id><clearance_id>148243</clearance_id><foreign>false</foreign><date>2023-11-03</date><amount>17000</amount><foreign_amount>0</foreign_amount><currency>ISK</currency><trans_key>05</trans_key><merchant_name>Bilaspa ehf.</merchant_name><due_date>2023-12-04</due_date><mcc>7542</mcc></withdrawal><withdrawal><entry_id>3.11.2023 13:08:20</entry_id><clearance_id>819952</clearance_id><foreign>false</foreign><date>2023-11-03</date><amount>599</amount><foreign_amount>0</foreign_amount><currency>ISK</currency><trans_key>05</trans_key><merchant_name>Parka - Bilastaedi</merchant_name><due_date>2023-12-04</due_date><mcc>7523</mcc></withdrawal><withdrawal><entry_id>3.11.2023 10:06:35</entry_id><clearance_id>634978</clearance_id><foreign>true</foreign><date>2023-11-03</date><amount>1712</amount><foreign_amount>-12.0</foreign_amount><currency>USD</currency><trans_key>05</trans_key><merchant_name>HARVEST</merchant_name><due_date>2023-12-04</due_date><mcc>5045</mcc></withdrawal><withdrawal><entry_id>2.11.2023 19:32:36</entry_id><clearance_id>236172</clearance_id><foreign>false</foreign><date>2023-11-02</date><amount>5100</amount><foreign_amount>0</foreign_amount><currency>ISK</currency><trans_key>05</trans_key><merchant_name>N1 Borgarnes</merchant_name><due_date>2023-12-04</due_date><mcc>5541</mcc></withdrawal><withdrawal><entry_id>2.11.2023 14:27:33</entry_id><clearance_id>732987</clearance_id><foreign>false</foreign><date>2023-11-02</date><amount>15470</amount><foreign_amount>0</foreign_amount><currency>ISK</currency><trans_key>05</trans_key><merchant_name>N1 Isafjordur</merchant_name><due_date>2023-12-04</due_date><mcc>5541</mcc></withdrawal><withdrawal><entry_id>2.11.2023 03:42:43</entry_id><clearance_id>242953</clearance_id><foreign>false</foreign><date>2023-11-02</date><amount>5948</amount><foreign_amount>0</foreign_amount><currency>ISK</currency><trans_key>05</trans_key><merchant_name>Virta EV Charge Processor</merchant_name><due_date>2023-12-04</due_date><mcc>5552</mcc></withdrawal></withdrawals><deposits><deposit><foreign>false</foreign><date>2023-11-27</date><description>Innborgun</description><amount>50000</amount><foreign_amount>0</foreign_amount><currency>ISK</currency></deposit><deposit><foreign>false</foreign><date>2023-11-24</date><description>Innborgun</description><amount>25000</amount><foreign_amount>0</foreign_amount><currency>ISK</currency></deposit><deposit><foreign>false</foreign><date>2023-11-24</date><description>Innborgun</description><amount>52000</amount><foreign_amount>0</foreign_amount><currency>ISK</currency></deposit><deposit><foreign>false</foreign><date>2023-11-23</date><description>Innborgun</description><amount>30000</amount><foreign_amount>0</foreign_amount><currency>ISK</currency></deposit><deposit><foreign>false</foreign><date>2023-11-07</date><description>Endurgreiðsla</description><amount>50013</amount><foreign_amount>0</foreign_amount><currency>ISK</currency></deposit><deposit><foreign>false</foreign><date>2023-11-03</date><description>Innborgun</description><amount>50000</amount><foreign_amount>0</foreign_amount><currency>ISK</currency></deposit><deposit><foreign>false</foreign><date>2023-11-02</date><description>Innborgun</description><amount>10000</amount><foreign_amount>0</foreign_amount><currency>ISK</currency></deposit></deposits></LI_Get_Creditcard_Transactions_response>