<?xml version="1.0" encoding="utf-8"?><LI_Get_Creditcard_Transactions_response xmlns:xsd="http://www.w3.org/2001/XMLSchema" xmlns:xsi="http://www.w3.org/2001/XMLSchema-instance" version="1.2"><time><date_arrived>2025-09-13T11:43:40.0955262+00:00</date_arrived><date_response>2025-09-13T11:43:41.0604926+00:00</date_response></time><balance>-75483.00</balance><award_point_state>0</award_point_state><total_withdrawal>971627.0</total_withdrawal><withdrawals><withdrawal><entry_id>29.9.2024 14:23:35</entry_id><clearance_id>335531</clearance_id><foreign>false</foreign><date>2024-09-29</date><amount>3065</amount><foreign_amount>0</foreign_amount><currency>ISK</currency><trans_key>05</trans_key><merchant_name>Braudgerd Reykjavikur</merchant_name><due_date>2024-10-02</due_date><mcc>5462</mcc></withdrawal><withdrawal><entry_id>28.9.2024 13:28:23</entry_id><clearance_id>823319</clearance_id><foreign>false</foreign><date>2024-09-28</date><amount>1790</amount><foreign_amount>0</foreign_amount><currency>ISK</currency><trans_key>05</trans_key><merchant_name>BRUT Restaurant</merchant_name><due_date>2024-10-02</due_date><mcc>5812</mcc></withdrawal><withdrawal><entry_id>28.9.2024 01:16:19</entry_id><clearance_id>619707</clearance_id><foreign>true</foreign><date>2024-09-28</date><amount>5144</amount><foreign_amount>-33.25</foreign_amount><currency>EUR</currency><trans_key>05</trans_key><merchant_name>GOOGLE*GOOGLE PLAY APP</merchant_name><due_date>2024-10-02</due_date><mcc>5816</mcc></withdrawal><withdrawal><entry_id>27.9.2024 09:52:44</entry_id><clearance_id>244499</clearance_id><foreign>false</foreign><date>2024-09-27</date><amount>16000</amount><foreign_amount>0</foreign_amount><currency>ISK</currency><trans_key>05</trans_key><merchant_name>Bilaspa ehf.</merchant_name><due_date>2024-10-02</due_date><mcc>7542</mcc></withdrawal><withdrawal><entry_id>25.9.2024 12:10:14</entry_id><clearance_id>014532</clearance_id><foreign>false</foreign><date>2024-09-25</date><amount>2990</amount><foreign_amount>0</foreign_amount><currency>ISK</currency><trans_key>05</trans_key><merchant_name>LA TRATTORIA</merchant_name><due_date>2024-10-02</due_date><mcc>5814</mcc></withdrawal><withdrawal><entry_id>25.9.2024 08:10:31</entry_id><clearance_id>031236</clearance_id><foreign>false</foreign><date>2024-09-25</date><amount>1000</amount><foreign_amount>0</foreign_amount><currency>ISK</currency><trans_key>05</trans_key><merchant_name>BRUT Restaurant</merchant_name><due_date>2024-10-02</due_date><mcc>5812</mcc></withdrawal><withdrawal><entry_id>24.9.2024 12:39:41</entry_id><clearance_id>941778</clearance_id><foreign>false</foreign><date>2024-09-24</date><amount>2590</amount><foreign_amount>0</foreign_amount><currency>ISK</currency><trans_key>05</trans_key><merchant_name>Islenski barinn ehf</merchant_name><due_date>2024-10-02</due_date><mcc>5813</mcc></withdrawal><withdrawal><entry_id>23.9.2024 12:46:12</entry_id><clearance_id>612409</clearance_id><foreign>false</foreign><date>2024-09-23</date><amount>4544</amount><foreign_amount>0</foreign_amount><currency>ISK</currency><trans_key>05</trans_key><merchant_name>FJALLKONAN</merchant_name><due_date>2024-10-02</due_date><mcc>5812</mcc></withdrawal><withdrawal><entry_id>22.9.2024 12:50:18</entry_id><clearance_id>018827</clearance_id><foreign>true</foreign><date>2024-09-22</date><amount>3122</amount><foreign_amount>-19.99</foreign_amount><currency>EUR</currency><trans_key>05</trans_key><merchant_name>SPOTIFY</merchant_name><due_date>2024-10-02</due_date><mcc>5815</mcc></withdrawal><withdrawal><entry_id>22.9.2024 11:13:41</entry_id><clearance_id>341064</clearance_id><foreign>false</foreign><date>2024-09-22</date><amount>258770</amount><foreign_amount>0</foreign_amount><currency>ISK</currency><trans_key>05</trans_key><merchant_name>HOTEL BUDIR</merchant_name><due_date>2024-10-02</due_date><mcc>7011</mcc></withdrawal><withdrawal><entry_id>21.9.2024 00:35:25</entry_id><clearance_id>525761</clearance_id><foreign>true</foreign><date>2024-09-21</date><amount>1469</amount><foreign_amount>-9.4</foreign_amount><currency>EUR</currency><trans_key>05</trans_key><merchant_name>MICROSOFT PAYMENTS</merchant_name><due_date>2024-10-02</due_date><mcc>5045</mcc></withdrawal><withdrawal><entry_id>19.9.2024 12:27:51</entry_id><clearance_id>751722</clearance_id><foreign>false</foreign><date>2024-09-19</date><amount>4580</amount><foreign_amount>0</foreign_amount><currency>ISK</currency><trans_key>05</trans_key><merchant_name>LA TRATTORIA</merchant_name><due_date>2024-10-02</due_date><mcc>5814</mcc></withdrawal><withdrawal><entry_id>18.9.2024 20:16:07</entry_id><clearance_id>607391</clearance_id><foreign>false</foreign><date>2024-09-18</date><amount>5800</amount><foreign_amount>0</foreign_amount><currency>ISK</currency><trans_key>05</trans_key><merchant_name>Nemendafelag Verzlunar</merchant_name><due_date>2024-10-02</due_date><mcc>8641</mcc></withdrawal><withdrawal><entry_id>17.9.2024 16:05:49</entry_id><clearance_id>549267</clearance_id><foreign>false</foreign><date>2024-09-17</date><amount>498980</amount><foreign_amount>0</foreign_amount><currency>ISK</currency><trans_key>05</trans_key><merchant_name>Herragardurinn Kringlu</merchant_name><due_date>2024-10-02</due_date><mcc>5651</mcc></withdrawal><withdrawal><entry_id>14.9.2024 16:58:39</entry_id><clearance_id>839703</clearance_id><foreign>false</foreign><date>2024-09-14</date><amount>88500</amount><foreign_amount>0</foreign_amount><currency>ISK</currency><trans_key>05</trans_key><merchant_name>Herragardurinn Kringlu</merchant_name><due_date>2024-10-02</due_date><mcc>5651</mcc></withdrawal><withdrawal><entry_id>14.9.2024 15:06:38</entry_id><clearance_id>638277</clearance_id><foreign>false</foreign><date>2024-09-14</date><amount>20837</amount><foreign_amount>0</foreign_amount><currency>ISK</currency><trans_key>05</trans_key><merchant_name>N1 Borgartun</merchant_name><due_date>2024-10-02</due_date><mcc>5541</mcc></withdrawal><withdrawal><entry_id>13.9.2024 11:26:04</entry_id><clearance_id>604079</clearance_id><foreign>true</foreign><date>2024-09-13</date><amount>3542</amount><foreign_amount>-22.65</foreign_amount><currency>EUR</currency><trans_key>05</trans_key><merchant_name>GOOGLE*GOOGLE PLAY APP</merchant_name><due_date>2024-10-02</due_date><mcc>5816</mcc></withdrawal><withdrawal><entry_id>12.9.2024 18:50:27</entry_id><clearance_id>026932</clearance_id><foreign>true</foreign><date>2024-09-12</date><amount>1875</amount><foreign_amount>-11.99</foreign_amount><currency>EUR</currency><trans_key>05</trans_key><merchant_name>GOOGLE*YOUTUBE</merchant_name><due_date>2024-10-02</due_date><mcc>5815</mcc></withdrawal><withdrawal><entry_id>12.9.2024 12:45:30</entry_id><clearance_id>530400</clearance_id><foreign>false</foreign><date>2024-09-12</date><amount>1000</amount><foreign_amount>0</foreign_amount><currency>ISK</currency><trans_key>05</trans_key><merchant_name>BRUT Restaurant</merchant_name><due_date>2024-10-02</due_date><mcc>5812</mcc></withdrawal><withdrawal><entry_id>12.9.2024 12:11:28</entry_id><clearance_id>128765</clearance_id><foreign>false</foreign><date>2024-09-12</date><amount>2186</amount><foreign_amount>0</foreign_amount><currency>ISK</currency><trans_key>05</trans_key><merchant_name>La Cuisine</merchant_name><due_date>2024-10-02</due_date><mcc>5812</mcc></withdrawal><withdrawal><entry_id>10.9.2024 12:51:24</entry_id><clearance_id>124341</clearance_id><foreign>false</foreign><date>2024-09-10</date><amount>2330</amount><foreign_amount>0</foreign_amount><currency>ISK</currency><trans_key>05</trans_key><merchant_name>BRUT Restaurant</merchant_name><due_date>2024-10-02</due_date><mcc>5812</mcc></withdrawal><withdrawal><entry_id>10.9.2024 12:08:43</entry_id><clearance_id>842958</clearance_id><foreign>false</foreign><date>2024-09-10</date><amount>6530</amount><foreign_amount>0</foreign_amount><currency>ISK</currency><trans_key>05</trans_key><merchant_name>LA TRATTORIA</merchant_name><due_date>2024-10-02</due_date><mcc>5814</mcc></withdrawal><withdrawal><entry_id>9.9.2024 04:54:12</entry_id><clearance_id>411912</clearance_id><foreign>true</foreign><date>2024-09-09</date><amount>724</amount><foreign_amount>-4.61</foreign_amount><currency>EUR</currency><trans_key>05</trans_key><merchant_name>Microsoft-G058668432</merchant_name><due_date>2024-10-02</due_date><mcc>5045</mcc></withdrawal><withdrawal><entry_id>8.9.2024 18:29:56</entry_id><clearance_id>956709</clearance_id><foreign>false</foreign><date>2024-09-08</date><amount>8150</amount><foreign_amount>0</foreign_amount><currency>ISK</currency><trans_key>05</trans_key><merchant_name>indican.is</merchant_name><due_date>2024-10-02</due_date><mcc>5814</mcc></withdrawal><withdrawal><entry_id>7.9.2024 02:52:44</entry_id><clearance_id>244215</clearance_id><foreign>true</foreign><date>2024-09-07</date><amount>2664</amount><foreign_amount>-16.98</foreign_amount><currency>EUR</currency><trans_key>05</trans_key><merchant_name>Netflix.com</merchant_name><due_date>2024-10-02</due_date><mcc>4899</mcc></withdrawal><withdrawal><entry_id>5.9.2024 10:12:13</entry_id><clearance_id>213511</clearance_id><foreign>true</foreign><date>2024-09-05</date><amount>1258</amount><foreign_amount>-8.0</foreign_amount><currency>EUR</currency><trans_key>05</trans_key><merchant_name>Dublin Express</merchant_name><due_date>2024-10-02</due_date><mcc>7512</mcc></withdrawal><withdrawal><entry_id>5.9.2024 05:07:34</entry_id><clearance_id>734791</clearance_id><foreign>false</foreign><date>2024-09-05</date><amount>2790</amount><foreign_amount>0</foreign_amount><currency>ISK</currency><trans_key>05</trans_key><merchant_name>HREYFILL 477</merchant_name><due_date>2024-10-02</due_date><mcc>4121</mcc></withdrawal><withdrawal><entry_id>4.9.2024 13:08:38</entry_id><clearance_id>837870</clearance_id><foreign>false</foreign><date>2024-09-04</date><amount>1930</amount><foreign_amount>0</foreign_amount><currency>ISK</currency><trans_key>05</trans_key><merchant_name>Kokka ehf.</merchant_name><due_date>2024-10-02</due_date><mcc>5722</mcc></withdrawal><withdrawal><entry_id>4.9.2024 12:33:11</entry_id><clearance_id>311283</clearance_id><foreign>false</foreign><date>2024-09-04</date><amount>4670</amount><foreign_amount>0</foreign_amount><currency>ISK</currency><trans_key>05</trans_key><merchant_name>FLATEY HLEMMUR</merchant_name><due_date>2024-10-02</due_date><mcc>5814</mcc></withdrawal><withdrawal><entry_id>3.9.2024 09:53:08</entry_id><clearance_id>308608</clearance_id><foreign>true</foreign><date>2024-09-03</date><amount>1706</amount><foreign_amount>-12.0</foreign_amount><currency>USD</currency><trans_key>05</trans_key><merchant_name>HARVEST</merchant_name><due_date>2024-10-02</due_date><mcc>5045</mcc></withdrawal><withdrawal><entry_id>3.9.2024 09:52:34</entry_id><clearance_id>234050</clearance_id><foreign>false</foreign><date>2024-09-03</date><amount>2050</amount><foreign_amount>0</foreign_amount><currency>ISK</currency><trans_key>05</trans_key><merchant_name>Reykjavik Roasters - B</merchant_name><due_date>2024-10-02</due_date><mcc>5812</mcc></withdrawal><withdrawal><entry_id>1.9.2024 18:30:32</entry_id><clearance_id>032821</clearance_id><foreign>false</foreign><date>2024-09-01</date><amount>4746</amount><foreign_amount>0</foreign_amount><currency>ISK</currency><trans_key>05</trans_key><merchant_name>Kronan Borgartuni</merchant_name><due_date>2024-10-02</due_date><mcc>5411</mcc></withdrawal><withdrawal><entry_id>1.9.2024 10:01:21</entry_id><clearance_id>121314</clearance_id><foreign>false</foreign><date>2024-09-01</date><amount>4295</amount><foreign_amount>0</foreign_amount><currency>ISK</currency><trans_key>05</trans_key><merchant_name>Te Kaffi - Laekjatorg</merchant_name><due_date>2024-10-02</due_date><mcc>5814</mcc></withdrawal></withdrawals><deposits><deposit><foreign>false</foreign><date>2024-09-30</date><description>Innborgun</description><amount>50000</amount><foreign_amount>0</foreign_amount><currency>ISK</currency></deposit><deposit><foreign>false</foreign><date>2024-09-23</date><description>Innborgun</description><amount>260000</amount><foreign_amount>0</foreign_amount><currency>ISK</currency></deposit><deposit><foreign>false</foreign><date>2024-09-20</date><description>Endurgreiðsla</description><amount>1682</amount><foreign_amount>10.84</foreign_amount><currency>EUR</currency></deposit><deposit><foreign>false</foreign><date>2024-09-17</date><description>Innborgun</description><amount>150000</amount><foreign_amount>0</foreign_amount><currency>ISK</currency></deposit><deposit><foreign>false</foreign><date>2024-09-17</date><description>Innborgun</description><amount>300000</amount><foreign_amount>0</foreign_amount><currency>ISK</currency></deposit><deposit><foreign>false</foreign><date>2024-09-16</date><description>Innborgun</description><amount>75000</amount><foreign_amount>0</foreign_amount><currency>ISK</currency></deposit><deposit><foreign>false</foreign><date>2024-09-16</date><description>Innborgun</description><amount>75000</amount><foreign_amount>0</foreign_amount><currency>ISK</currency></deposit><deposit><foreign>false</foreign><date>2024-09-16</date><description>Innborgun</description><amount>50000</amount><foreign_amount>0</foreign_amount><currency>ISK</currency></deposit><deposit><foreign>false</foreign><date>2024-09-09</date><description>Innborgun</description><amount>30000</amount><foreign_amount>0</foreign_amount><currency>ISK</currency></deposit></deposits></LI_Get_Creditcard_Transactions_response>