<?xml version="1.0" encoding="utf-8"?><LI_Get_Creditcard_Transactions_response xmlns:xsd="http://www.w3.org/2001/XMLSchema" xmlns:xsi="http://www.w3.org/2001/XMLSchema-instance" version="1.2"><time><date_arrived>2025-09-13T11:43:41.9655496+00:00</date_arrived><date_response>2025-09-13T11:43:43.2860922+00:00</date_response></time><balance>-75483.00</balance><award_point_state>0</award_point_state><total_withdrawal>208097.0</total_withdrawal><withdrawals><withdrawal><entry_id>29.11.2024 01:23:26</entry_id><clearance_id>325939</clearance_id><foreign>false</foreign><date>2024-11-29</date><amount>349</amount><foreign_amount>0</foreign_amount><currency>ISK</currency><trans_key>05</trans_key><merchant_name>HOPP* SCOOTER</merchant_name><due_date>2024-12-02</due_date><mcc>5399</mcc></withdrawal><withdrawal><entry_id>28.11.2024 21:38:56</entry_id><clearance_id>856770</clearance_id><foreign>false</foreign><date>2024-11-28</date><amount>388</amount><foreign_amount>0</foreign_amount><currency>ISK</currency><trans_key>05</trans_key><merchant_name>HOPP* SCOOTER</merchant_name><due_date>2024-12-02</due_date><mcc>5399</mcc></withdrawal><withdrawal><entry_id>27.11.2024 13:08:21</entry_id><clearance_id>821469</clearance_id><foreign>false</foreign><date>2024-11-27</date><amount>3785</amount><foreign_amount>0</foreign_amount><currency>ISK</currency><trans_key>05</trans_key><merchant_name>Duck Rose</merchant_name><due_date>2024-12-02</due_date><mcc>5812</mcc></withdrawal><withdrawal><entry_id>25.11.2024 12:47:17</entry_id><clearance_id>717086</clearance_id><foreign>false</foreign><date>2024-11-25</date><amount>2745</amount><foreign_amount>0</foreign_amount><currency>ISK</currency><trans_key>05</trans_key><merchant_name>FJALLKONAN</merchant_name><due_date>2024-12-02</due_date><mcc>5812</mcc></withdrawal><withdrawal><entry_id>22.11.2024 12:50:15</entry_id><clearance_id>015395</clearance_id><foreign>true</foreign><date>2024-11-22</date><amount>3014</amount><foreign_amount>-19.99</foreign_amount><currency>EUR</currency><trans_key>05</trans_key><merchant_name>SPOTIFY</merchant_name><due_date>2024-12-02</due_date><mcc>5815</mcc></withdrawal><withdrawal><entry_id>21.11.2024 13:59:37</entry_id><clearance_id>936897</clearance_id><foreign>false</foreign><date>2024-11-21</date><amount>3038</amount><foreign_amount>0</foreign_amount><currency>ISK</currency><trans_key>05</trans_key><merchant_name>Islenski Barinn</merchant_name><due_date>2024-12-02</due_date><mcc>5813</mcc></withdrawal><withdrawal><entry_id>21.11.2024 00:21:53</entry_id><clearance_id>153060</clearance_id><foreign>true</foreign><date>2024-11-21</date><amount>3521</amount><foreign_amount>-23.4</foreign_amount><currency>EUR</currency><trans_key>05</trans_key><merchant_name>MSFT * E0500UDDO8</merchant_name><due_date>2024-12-02</due_date><mcc>5045</mcc></withdrawal><withdrawal><entry_id>17.11.2024 13:52:04</entry_id><clearance_id>204101</clearance_id><foreign>false</foreign><date>2024-11-17</date><amount>18625</amount><foreign_amount>0</foreign_amount><currency>ISK</currency><trans_key>05</trans_key><merchant_name>COS</merchant_name><due_date>2024-12-02</due_date><mcc>5651</mcc></withdrawal><withdrawal><entry_id>17.11.2024 13:21:01</entry_id><clearance_id>101279</clearance_id><foreign>false</foreign><date>2024-11-17</date><amount>4350</amount><foreign_amount>0</foreign_amount><currency>ISK</currency><trans_key>05</trans_key><merchant_name>SIGURANNA EHF</merchant_name><due_date>2024-12-02</due_date><mcc>5814</mcc></withdrawal><withdrawal><entry_id>17.11.2024 01:44:48</entry_id><clearance_id>448741</clearance_id><foreign>true</foreign><date>2024-11-17</date><amount>10745</amount><foreign_amount>-71.99</foreign_amount><currency>EUR</currency><trans_key>05</trans_key><merchant_name>PlayStation Network</merchant_name><due_date>2024-12-02</due_date><mcc>5816</mcc></withdrawal><withdrawal><entry_id>17.11.2024 01:36:08</entry_id><clearance_id>608019</clearance_id><foreign>true</foreign><date>2024-11-17</date><amount>16417</amount><foreign_amount>-109.99</foreign_amount><currency>EUR</currency><trans_key>05</trans_key><merchant_name>PlayStation Network</merchant_name><due_date>2024-12-02</due_date><mcc>5816</mcc></withdrawal><withdrawal><entry_id>16.11.2024 20:58:17</entry_id><clearance_id>817350</clearance_id><foreign>false</foreign><date>2024-11-16</date><amount>3283</amount><foreign_amount>0</foreign_amount><currency>ISK</currency><trans_key>05</trans_key><merchant_name>Kronan Borgartuni</merchant_name><due_date>2024-12-02</due_date><mcc>5411</mcc></withdrawal><withdrawal><entry_id>16.11.2024 15:18:29</entry_id><clearance_id>829091</clearance_id><foreign>false</foreign><date>2024-11-16</date><amount>4960</amount><foreign_amount>0</foreign_amount><currency>ISK</currency><trans_key>05</trans_key><merchant_name>FLATEY KRINGLAN</merchant_name><due_date>2024-12-02</due_date><mcc>5814</mcc></withdrawal><withdrawal><entry_id>16.11.2024 00:03:33</entry_id><clearance_id>332838</clearance_id><foreign>true</foreign><date>2024-11-16</date><amount>4477</amount><foreign_amount>-29.99</foreign_amount><currency>EUR</currency><trans_key>05</trans_key><merchant_name>PlayStation Network</merchant_name><due_date>2024-12-02</due_date><mcc>5816</mcc></withdrawal><withdrawal><entry_id>13.11.2024 11:26:03</entry_id><clearance_id>603634</clearance_id><foreign>true</foreign><date>2024-11-13</date><amount>3440</amount><foreign_amount>-22.65</foreign_amount><currency>EUR</currency><trans_key>05</trans_key><merchant_name>GOOGLE*GOOGLE PLAY APP</merchant_name><due_date>2024-12-02</due_date><mcc>5734</mcc></withdrawal><withdrawal><entry_id>12.11.2024 18:50:26</entry_id><clearance_id>026504</clearance_id><foreign>true</foreign><date>2024-11-12</date><amount>1830</amount><foreign_amount>-11.99</foreign_amount><currency>EUR</currency><trans_key>05</trans_key><merchant_name>GOOGLE*YOUTUBE</merchant_name><due_date>2024-12-02</due_date><mcc>5968</mcc></withdrawal><withdrawal><entry_id>12.11.2024 12:17:57</entry_id><clearance_id>757660</clearance_id><foreign>false</foreign><date>2024-11-12</date><amount>2990</amount><foreign_amount>0</foreign_amount><currency>ISK</currency><trans_key>05</trans_key><merchant_name>LA TRATTORIA</merchant_name><due_date>2024-12-02</due_date><mcc>5814</mcc></withdrawal><withdrawal><entry_id>12.11.2024 09:41:42</entry_id><clearance_id>142106</clearance_id><foreign>false</foreign><date>2024-11-12</date><amount>15225</amount><foreign_amount>0</foreign_amount><currency>ISK</currency><trans_key>05</trans_key><merchant_name>Kronan Borgartuni</merchant_name><due_date>2024-12-02</due_date><mcc>5411</mcc></withdrawal><withdrawal><entry_id>11.11.2024 20:33:27</entry_id><clearance_id>327766</clearance_id><foreign>false</foreign><date>2024-11-11</date><amount>15809</amount><foreign_amount>0</foreign_amount><currency>ISK</currency><trans_key>05</trans_key><merchant_name>AMAZON MKTPL*DK03H6K73</merchant_name><due_date>2024-12-02</due_date><mcc>5999</mcc></withdrawal><withdrawal><entry_id>9.11.2024 06:38:26</entry_id><clearance_id>825852</clearance_id><foreign>true</foreign><date>2024-11-09</date><amount>684</amount><foreign_amount>-4.46</foreign_amount><currency>EUR</currency><trans_key>05</trans_key><merchant_name>Microsoft-G065655552</merchant_name><due_date>2024-12-02</due_date><mcc>5045</mcc></withdrawal><withdrawal><entry_id>8.11.2024 14:45:26</entry_id><clearance_id>526615</clearance_id><foreign>false</foreign><date>2024-11-08</date><amount>2040</amount><foreign_amount>0</foreign_amount><currency>ISK</currency><trans_key>05</trans_key><merchant_name>Perlan Veitingahus</merchant_name><due_date>2024-12-02</due_date><mcc>5812</mcc></withdrawal><withdrawal><entry_id>7.11.2024 14:20:05</entry_id><clearance_id>004931</clearance_id><foreign>false</foreign><date>2024-11-07</date><amount>7890</amount><foreign_amount>0</foreign_amount><currency>ISK</currency><trans_key>05</trans_key><merchant_name>Nautholl</merchant_name><due_date>2024-12-02</due_date><mcc>5814</mcc></withdrawal><withdrawal><entry_id>7.11.2024 03:24:51</entry_id><clearance_id>451385</clearance_id><foreign>true</foreign><date>2024-11-07</date><amount>2939</amount><foreign_amount>-18.98</foreign_amount><currency>EUR</currency><trans_key>05</trans_key><merchant_name>Netflix.com</merchant_name><due_date>2024-12-02</due_date><mcc>4899</mcc></withdrawal><withdrawal><entry_id>6.11.2024 12:54:28</entry_id><clearance_id>428155</clearance_id><foreign>false</foreign><date>2024-11-06</date><amount>1000</amount><foreign_amount>0</foreign_amount><currency>ISK</currency><trans_key>05</trans_key><merchant_name>BRUT Restaurant</merchant_name><due_date>2024-12-02</due_date><mcc>5812</mcc></withdrawal><withdrawal><entry_id>6.11.2024 12:46:41</entry_id><clearance_id>641505</clearance_id><foreign>false</foreign><date>2024-11-06</date><amount>3385</amount><foreign_amount>0</foreign_amount><currency>ISK</currency><trans_key>05</trans_key><merchant_name>Kopar</merchant_name><due_date>2024-12-02</due_date><mcc>5812</mcc></withdrawal><withdrawal><entry_id>5.11.2024 12:17:39</entry_id><clearance_id>738932</clearance_id><foreign>false</foreign><date>2024-11-05</date><amount>2990</amount><foreign_amount>0</foreign_amount><currency>ISK</currency><trans_key>05</trans_key><merchant_name>LA TRATTORIA</merchant_name><due_date>2024-12-02</due_date><mcc>5814</mcc></withdrawal><withdrawal><entry_id>4.11.2024 12:55:55</entry_id><clearance_id>555207</clearance_id><foreign>false</foreign><date>2024-11-04</date><amount>622</amount><foreign_amount>0</foreign_amount><currency>ISK</currency><trans_key>05</trans_key><merchant_name>Eymundsson Austurstrae</merchant_name><due_date>2024-12-02</due_date><mcc>5942</mcc></withdrawal><withdrawal><entry_id>4.11.2024 12:52:56</entry_id><clearance_id>256138</clearance_id><foreign>false</foreign><date>2024-11-04</date><amount>2990</amount><foreign_amount>0</foreign_amount><currency>ISK</currency><trans_key>05</trans_key><merchant_name>Duck Rose</merchant_name><due_date>2024-12-02</due_date><mcc>5812</mcc></withdrawal><withdrawal><entry_id>3.11.2024 15:30:40</entry_id><clearance_id>040411</clearance_id><foreign>false</foreign><date>2024-11-03</date><amount>3480</amount><foreign_amount>0</foreign_amount><currency>ISK</currency><trans_key>05</trans_key><merchant_name>SANDHOLT</merchant_name><due_date>2024-12-02</due_date><mcc>5462</mcc></withdrawal><withdrawal><entry_id>3.11.2024 09:58:48</entry_id><clearance_id>848749</clearance_id><foreign>true</foreign><date>2024-11-03</date><amount>1686</amount><foreign_amount>-12.0</foreign_amount><currency>USD</currency><trans_key>05</trans_key><merchant_name>HARVEST</merchant_name><due_date>2024-12-02</due_date><mcc>5045</mcc></withdrawal><withdrawal><entry_id>1.11.2024 22:05:34</entry_id><clearance_id>533955</clearance_id><foreign>false</foreign><date>2024-11-01</date><amount>47090</amount><foreign_amount>0</foreign_amount><currency>ISK</currency><trans_key>05</trans_key><merchant_name>ROK</merchant_name><due_date>2024-12-02</due_date><mcc>5812</mcc></withdrawal><withdrawal><entry_id>1.11.2024 16:10:29</entry_id><clearance_id>028948</clearance_id><foreign>false</foreign><date>2024-11-01</date><amount>6000</amount><foreign_amount>0</foreign_amount><currency>ISK</currency><trans_key>05</trans_key><merchant_name>2Guys</merchant_name><due_date>2024-12-02</due_date><mcc>5812</mcc></withdrawal><withdrawal><entry_id>1.11.2024 15:00:12</entry_id><clearance_id>012161</clearance_id><foreign>false</foreign><date>2024-11-01</date><amount>6000</amount><foreign_amount>0</foreign_amount><currency>ISK</currency><trans_key>05</trans_key><merchant_name>2Guys</merchant_name><due_date>2024-12-02</due_date><mcc>5812</mcc></withdrawal><withdrawal><entry_id>1.11.2024 14:13:08</entry_id><clearance_id>308804</clearance_id><foreign>false</foreign><date>2024-11-01</date><amount>310</amount><foreign_amount>0</foreign_amount><currency>ISK</currency><trans_key>05</trans_key><merchant_name>HOPP* SCOOTER</merchant_name><due_date>2024-12-02</due_date><mcc>5399</mcc></withdrawal></withdrawals><deposits><deposit><foreign>false</foreign><date>2024-11-21</date><description>Innborgun</description><amount>50000</amount><foreign_amount>0</foreign_amount><currency>ISK</currency></deposit><deposit><foreign>false</foreign><date>2024-11-20</date><description>Endurgreiðsla</description><amount>180</amount><foreign_amount>1.21</foreign_amount><currency>EUR</currency></deposit><deposit><foreign>false</foreign><date>2024-11-11</date><description>Innborgun</description><amount>100000</amount><foreign_amount>0</foreign_amount><currency>ISK</currency></deposit><deposit><foreign>false</foreign><date>2024-11-04</date><description>Innborgun</description><amount>50000</amount><foreign_amount>0</foreign_amount><currency>ISK</currency></deposit></deposits></LI_Get_Creditcard_Transactions_response>