<?xml version="1.0" encoding="utf-8"?><LI_Get_Creditcard_Transactions_response xmlns:xsd="http://www.w3.org/2001/XMLSchema" xmlns:xsi="http://www.w3.org/2001/XMLSchema-instance" version="1.2"><time><date_arrived>2025-09-13T11:43:47.9326876+00:00</date_arrived><date_response>2025-09-13T11:43:48.2608466+00:00</date_response></time><balance>-75483.00</balance><award_point_state>0</award_point_state><total_withdrawal>440670.0</total_withdrawal><withdrawals><withdrawal><entry_id>31.7.2025 14:06:16</entry_id><clearance_id>616337</clearance_id><foreign>false</foreign><date>2025-07-31</date><amount>6690</amount><foreign_amount>0</foreign_amount><currency>ISK</currency><trans_key>05</trans_key><merchant_name>APOTEK RESTAURANT</merchant_name><due_date>2025-08-05</due_date><mcc>5812</mcc></withdrawal><withdrawal><entry_id>30.7.2025 13:29:42</entry_id><clearance_id>942272</clearance_id><foreign>false</foreign><date>2025-07-30</date><amount>3690</amount><foreign_amount>0</foreign_amount><currency>ISK</currency><trans_key>05</trans_key><merchant_name>Duck Rose</merchant_name><due_date>2025-08-05</due_date><mcc>5812</mcc></withdrawal><withdrawal><entry_id>29.7.2025 12:45:19</entry_id><clearance_id>519633</clearance_id><foreign>false</foreign><date>2025-07-29</date><amount>2990</amount><foreign_amount>0</foreign_amount><currency>ISK</currency><trans_key>05</trans_key><merchant_name>La Trattoria</merchant_name><due_date>2025-08-05</due_date><mcc>5812</mcc></withdrawal><withdrawal><entry_id>28.7.2025 12:23:52</entry_id><clearance_id>352793</clearance_id><foreign>false</foreign><date>2025-07-28</date><amount>3690</amount><foreign_amount>0</foreign_amount><currency>ISK</currency><trans_key>05</trans_key><merchant_name>Fuku Mama</merchant_name><due_date>2025-08-05</due_date><mcc>5812</mcc></withdrawal><withdrawal><entry_id>27.7.2025 16:04:39</entry_id><clearance_id>439203</clearance_id><foreign>false</foreign><date>2025-07-27</date><amount>2940</amount><foreign_amount>0</foreign_amount><currency>ISK</currency><trans_key>05</trans_key><merchant_name>Kaktus - Listasafn Isl</merchant_name><due_date>2025-08-05</due_date><mcc>5812</mcc></withdrawal><withdrawal><entry_id>27.7.2025 15:36:26</entry_id><clearance_id>626216</clearance_id><foreign>false</foreign><date>2025-07-27</date><amount>29010</amount><foreign_amount>0</foreign_amount><currency>ISK</currency><trans_key>05</trans_key><merchant_name>Snaps ehf</merchant_name><due_date>2025-08-05</due_date><mcc>5812</mcc></withdrawal><withdrawal><entry_id>26.7.2025 00:44:01</entry_id><clearance_id>401472</clearance_id><foreign>false</foreign><date>2025-07-26</date><amount>349</amount><foreign_amount>0</foreign_amount><currency>ISK</currency><trans_key>05</trans_key><merchant_name>HOPP* SCOOTER</merchant_name><due_date>2025-08-05</due_date><mcc>5399</mcc></withdrawal><withdrawal><entry_id>25.7.2025 22:38:07</entry_id><clearance_id>807082</clearance_id><foreign>false</foreign><date>2025-07-25</date><amount>132000</amount><foreign_amount>0</foreign_amount><currency>ISK</currency><trans_key>05</trans_key><merchant_name>OX</merchant_name><due_date>2025-08-05</due_date><mcc>5812</mcc></withdrawal><withdrawal><entry_id>24.7.2025 13:25:03</entry_id><clearance_id>502888</clearance_id><foreign>false</foreign><date>2025-07-24</date><amount>4590</amount><foreign_amount>0</foreign_amount><currency>ISK</currency><trans_key>05</trans_key><merchant_name>Islenski Barinn</merchant_name><due_date>2025-08-05</due_date><mcc>5813</mcc></withdrawal><withdrawal><entry_id>23.7.2025 12:41:01</entry_id><clearance_id>101168</clearance_id><foreign>false</foreign><date>2025-07-23</date><amount>41020</amount><foreign_amount>0</foreign_amount><currency>ISK</currency><trans_key>05</trans_key><merchant_name>BYGGT OG BUID EHF.</merchant_name><due_date>2025-08-05</due_date><mcc>5722</mcc></withdrawal><withdrawal><entry_id>22.7.2025 12:50:23</entry_id><clearance_id>023160</clearance_id><foreign>true</foreign><date>2025-07-22</date><amount>2919</amount><foreign_amount>-19.99</foreign_amount><currency>EUR</currency><trans_key>05</trans_key><merchant_name>SPOTIFY</merchant_name><due_date>2025-08-05</due_date><mcc>5815</mcc></withdrawal><withdrawal><entry_id>21.7.2025 00:34:14</entry_id><clearance_id>414186</clearance_id><foreign>true</foreign><date>2025-07-21</date><amount>3421</amount><foreign_amount>-23.4</foreign_amount><currency>EUR</currency><trans_key>05</trans_key><merchant_name>MSFT * E0500WW72H</merchant_name><due_date>2025-08-05</due_date><mcc>5045</mcc></withdrawal><withdrawal><entry_id>20.7.2025 11:53:15</entry_id><clearance_id>152030</clearance_id><foreign>false</foreign><date>2025-07-20</date><amount>9247</amount><foreign_amount>0</foreign_amount><currency>ISK</currency><trans_key>05</trans_key><merchant_name>OB AKUREYRI</merchant_name><due_date>2025-08-05</due_date><mcc>5542</mcc></withdrawal><withdrawal><entry_id>19.7.2025 19:21:45</entry_id><clearance_id>145373</clearance_id><foreign>false</foreign><date>2025-07-19</date><amount>19025</amount><foreign_amount>0</foreign_amount><currency>ISK</currency><trans_key>05</trans_key><merchant_name>Indian curry house</merchant_name><due_date>2025-08-05</due_date><mcc>5812</mcc></withdrawal><withdrawal><entry_id>19.7.2025 14:41:22</entry_id><clearance_id>122645</clearance_id><foreign>true</foreign><date>2025-07-19</date><amount>2504</amount><foreign_amount>-20.0</foreign_amount><currency>USD</currency><trans_key>05</trans_key><merchant_name>CLAUDE.AI SUBSCRIPTION</merchant_name><due_date>2025-08-05</due_date><mcc>5734</mcc></withdrawal><withdrawal><entry_id>18.7.2025 12:55:07</entry_id><clearance_id>506887</clearance_id><foreign>false</foreign><date>2025-07-18</date><amount>14960</amount><foreign_amount>0</foreign_amount><currency>ISK</currency><trans_key>05</trans_key><merchant_name>Ketilkaffi</merchant_name><due_date>2025-08-05</due_date><mcc>5812</mcc></withdrawal><withdrawal><entry_id>15.7.2025 21:24:29</entry_id><clearance_id>429362</clearance_id><foreign>false</foreign><date>2025-07-15</date><amount>466</amount><foreign_amount>0</foreign_amount><currency>ISK</currency><trans_key>05</trans_key><merchant_name>HOPP* SCOOTER</merchant_name><due_date>2025-08-05</due_date><mcc>5399</mcc></withdrawal><withdrawal><entry_id>15.7.2025 16:29:25</entry_id><clearance_id>925445</clearance_id><foreign>false</foreign><date>2025-07-15</date><amount>20530</amount><foreign_amount>0</foreign_amount><currency>ISK</currency><trans_key>05</trans_key><merchant_name>Baccala Bar</merchant_name><due_date>2025-08-05</due_date><mcc>5812</mcc></withdrawal><withdrawal><entry_id>15.7.2025 12:45:12</entry_id><clearance_id>326433</clearance_id><foreign>false</foreign><date>2025-07-15</date><amount>15000</amount><foreign_amount>0</foreign_amount><currency>ISK</currency><trans_key>05</trans_key><merchant_name>OB Sjafnargata</merchant_name><due_date>2025-08-05</due_date><mcc>5542</mcc></withdrawal><withdrawal><entry_id>13.7.2025 15:17:26</entry_id><clearance_id>726049</clearance_id><foreign>false</foreign><date>2025-07-13</date><amount>661</amount><foreign_amount>0</foreign_amount><currency>ISK</currency><trans_key>05</trans_key><merchant_name>HOPP* SCOOTER</merchant_name><due_date>2025-08-05</due_date><mcc>5399</mcc></withdrawal><withdrawal><entry_id>13.7.2025 12:59:48</entry_id><clearance_id>948176</clearance_id><foreign>false</foreign><date>2025-07-13</date><amount>427</amount><foreign_amount>0</foreign_amount><currency>ISK</currency><trans_key>05</trans_key><merchant_name>HOPP* SCOOTER</merchant_name><due_date>2025-08-05</due_date><mcc>5399</mcc></withdrawal><withdrawal><entry_id>13.7.2025 11:26:04</entry_id><clearance_id>603974</clearance_id><foreign>true</foreign><date>2025-07-13</date><amount>3305</amount><foreign_amount>-22.65</foreign_amount><currency>EUR</currency><trans_key>05</trans_key><merchant_name>Google Play Apps</merchant_name><due_date>2025-08-05</due_date><mcc>7372</mcc></withdrawal><withdrawal><entry_id>13.7.2025 03:52:23</entry_id><clearance_id>222845</clearance_id><foreign>false</foreign><date>2025-07-13</date><amount>349</amount><foreign_amount>0</foreign_amount><currency>ISK</currency><trans_key>05</trans_key><merchant_name>HOPP* SCOOTER</merchant_name><due_date>2025-08-05</due_date><mcc>5399</mcc></withdrawal><withdrawal><entry_id>12.7.2025 19:50:59</entry_id><clearance_id>058912</clearance_id><foreign>false</foreign><date>2025-07-12</date><amount>622</amount><foreign_amount>0</foreign_amount><currency>ISK</currency><trans_key>05</trans_key><merchant_name>HOPP* SCOOTER</merchant_name><due_date>2025-08-05</due_date><mcc>5399</mcc></withdrawal><withdrawal><entry_id>12.7.2025 18:50:26</entry_id><clearance_id>026502</clearance_id><foreign>true</foreign><date>2025-07-12</date><amount>2187</amount><foreign_amount>-14.99</foreign_amount><currency>EUR</currency><trans_key>05</trans_key><merchant_name>Google YouTube</merchant_name><due_date>2025-08-05</due_date><mcc>5817</mcc></withdrawal><withdrawal><entry_id>11.7.2025 14:08:54</entry_id><clearance_id>737489</clearance_id><foreign>false</foreign><date>2025-07-11</date><amount>9323</amount><foreign_amount>0</foreign_amount><currency>ISK</currency><trans_key>05</trans_key><merchant_name>OB Bolungarvik</merchant_name><due_date>2025-08-05</due_date><mcc>5542</mcc></withdrawal><withdrawal><entry_id>10.7.2025 19:05:26</entry_id><clearance_id>526204</clearance_id><foreign>false</foreign><date>2025-07-10</date><amount>12320</amount><foreign_amount>0</foreign_amount><currency>ISK</currency><trans_key>05</trans_key><merchant_name>KAFFIHUSID HUSID</merchant_name><due_date>2025-08-05</due_date><mcc>5813</mcc></withdrawal><withdrawal><entry_id>9.7.2025 07:42:12</entry_id><clearance_id>212474</clearance_id><foreign>true</foreign><date>2025-07-09</date><amount>628</amount><foreign_amount>-4.27</foreign_amount><currency>EUR</currency><trans_key>05</trans_key><merchant_name>Microsoft-G100858383</merchant_name><due_date>2025-08-05</due_date><mcc>5045</mcc></withdrawal><withdrawal><entry_id>7.7.2025 13:26:42</entry_id><clearance_id>453531</clearance_id><foreign>false</foreign><date>2025-07-07</date><amount>15000</amount><foreign_amount>0</foreign_amount><currency>ISK</currency><trans_key>05</trans_key><merchant_name>OB Bolungarvik</merchant_name><due_date>2025-08-05</due_date><mcc>5542</mcc></withdrawal><withdrawal><entry_id>7.7.2025 12:53:48</entry_id><clearance_id>348145</clearance_id><foreign>true</foreign><date>2025-07-07</date><amount>48807</amount><foreign_amount>-394.2</foreign_amount><currency>USD</currency><trans_key>05</trans_key><merchant_name>ICELANDAIR. 1082416542302</merchant_name><due_date>2025-08-05</due_date><mcc>3050</mcc></withdrawal><withdrawal><entry_id>6.7.2025 00:53:57</entry_id><clearance_id>357647</clearance_id><foreign>true</foreign><date>2025-07-06</date><amount>2770</amount><foreign_amount>-18.98</foreign_amount><currency>EUR</currency><trans_key>05</trans_key><merchant_name>NETFLIX.COM</merchant_name><due_date>2025-08-05</due_date><mcc>4899</mcc></withdrawal><withdrawal><entry_id>3.7.2025 19:35:49</entry_id><clearance_id>549456</clearance_id><foreign>false</foreign><date>2025-07-03</date><amount>18140</amount><foreign_amount>0</foreign_amount><currency>ISK</currency><trans_key>05</trans_key><merchant_name>Icelandair ticket sale</merchant_name><due_date>2025-08-05</due_date><mcc>4511</mcc></withdrawal><withdrawal><entry_id>3.7.2025 09:39:49</entry_id><clearance_id>949304</clearance_id><foreign>true</foreign><date>2025-07-03</date><amount>1488</amount><foreign_amount>-12.0</foreign_amount><currency>USD</currency><trans_key>05</trans_key><merchant_name>HARVEST</merchant_name><due_date>2025-08-05</due_date><mcc>5045</mcc></withdrawal><withdrawal><entry_id>2.7.2025 13:52:07</entry_id><clearance_id>207675</clearance_id><foreign>false</foreign><date>2025-07-02</date><amount>4001</amount><foreign_amount>0</foreign_amount><currency>ISK</currency><trans_key>05</trans_key><merchant_name>Isorka</merchant_name><due_date>2025-08-05</due_date><mcc>5552</mcc></withdrawal><withdrawal><entry_id>1.7.2025 16:03:32</entry_id><clearance_id>331880</clearance_id><foreign>false</foreign><date>2025-07-01</date><amount>5601</amount><foreign_amount>0</foreign_amount><currency>ISK</currency><trans_key>05</trans_key><merchant_name>STR*JYSK Skeifan</merchant_name><due_date>2025-08-05</due_date><mcc>5712</mcc></withdrawal></withdrawals><deposits><deposit><foreign>false</foreign><date>2025-07-28</date><description>Innborgun</description><amount>150000</amount><foreign_amount>0</foreign_amount><currency>ISK</currency></deposit><deposit><foreign>false</foreign><date>2025-07-28</date><description>Innborgun</description><amount>50000</amount><foreign_amount>0</foreign_amount><currency>ISK</currency></deposit><deposit><foreign>false</foreign><date>2025-07-23</date><description>Innborgun</description><amount>50000</amount><foreign_amount>0</foreign_amount><currency>ISK</currency></deposit><deposit><foreign>false</foreign><date>2025-07-18</date><description>Innborgun</description><amount>50000</amount><foreign_amount>0</foreign_amount><currency>ISK</currency></deposit><deposit><foreign>false</foreign><date>2025-07-14</date><description>Innborgun</description><amount>50000</amount><foreign_amount>0</foreign_amount><currency>ISK</currency></deposit><deposit><foreign>false</foreign><date>2025-07-07</date><description>Innborgun</description><amount>60000</amount><foreign_amount>0</foreign_amount><currency>ISK</currency></deposit><deposit><foreign>false</foreign><date>2025-07-07</date><description>Endurgreiðsla</description><amount>13400</amount><foreign_amount>0</foreign_amount><currency>ISK</currency></deposit><deposit><foreign>false</foreign><date>2025-07-01</date><description>Innborgun</description><amount>50000</amount><foreign_amount>0</foreign_amount><currency>ISK</currency></deposit></deposits></LI_Get_Creditcard_Transactions_response>